{
  "esquema": "panlabs-aws-diagrams/tema@1",
  "id": "corporativo",
  "rotulo": "Corporativo sóbrio",
  "porque": "O terceiro tema que o ticket pediu — e o que a régua obrigou a repensar. A ideia natural (fundo off-white institucional) é proibida pela medição: a partir de `#FEFEFE` a paleta AWS começa a cair abaixo de 3:1. Sobra a margem estética REAL, que é a camada da casa: tipografia (Arial normativa, corpo menor, título 24 pt), respiro (densidade 1,25), tinta de seta mais leve (`#545B64`, a que os próprios templates AWS do draw.io usam), cantos vivos como as 156 lâminas do deck, qualificador em itálico (O21) e a linha de revisão técnica dos Reference Architecture PDFs (O24).",
  "fundo": "claro",
  "herda": "claro",
  "texto": {
    "familia": "Arial",
    "rotulo": 11,
    "grupo": 12,
    "aresta": 10,
    "titulo": 24,
    "subtitulo": 12,
    "qualificador": true
  },
  "aresta": {
    "cor": "#545B64",
    "espessura": 1.4,
    "ponta": "open",
    "cantos": 0,
    "saltos": "arc",
    "fluxo": "solido"
  },
  "folga": { "base": 8, "densidade": 1.25 },
  "bloco": { "fundo": "#FFFFFF", "borda": "#5A6C86", "cantos": 0 },
  "nota": { "fundo": "#FFFFFF", "borda": "#7D8998", "tinta": "#232F3E" },
  "cartao": { "revisao": "Revisado para exatidão técnica em 2026-08-21" }
}
