{
  "esquema": "panlabs-aws-diagrams/tema@1",
  "id": "armadilha",
  "rotulo": "Armadilha (rejeitado pelo portão)",
  "porque": "Um tema DIZÍVEL e ERRADO, de propósito. Pede o off-white corporativo que todo mundo pede (`#F2F3F5`), tinta cinza-clara elegante e seta fininha. Nenhuma linha aqui é proibida pelo vocabulário — e é exatamente por isso que ele existe: mostra o que o vocabulário fechado NÃO alcança e o portão de contraste alcança. Gerado só com `--forcar`.",
  "fundo": "claro",
  "herda": "claro",
  "pagina": { "cor": "#F2F3F5", "margem": 32 },
  "tinta": { "forte": "#5A6C86", "fraca": "#AAB7B8", "halo": "#F2F3F5" },
  "aresta": { "cor": "#AAB7B8", "espessura": 1.0, "ponta": "open", "cantos": 12, "saltos": "arc", "fluxo": "tracejado" }
}
